{
  "artifacts": [
    {
      "digest": "sha256:d0df2f80a4ecc591507ba40b2864cfdcb1133d85ed76c1cc612ed89823b970d0",
      "kind": "executable",
      "path": "runtime/adapter.py"
    }
  ],
  "contracts": [
    {
      "contract_id": "tobkiri.service.connector.adapter.v1",
      "operations": [
        "rumi_qr_pairing_connector_pack.qr-pairing-adapter"
      ],
      "revision_digest": "sha256:4ae4f5aebae13501d88b1c7aab9172e79147981842aea670ec65931e99d2e7f2"
    }
  ],
  "functions": [
    {
      "contract_revision_digest": "sha256:4ae4f5aebae13501d88b1c7aab9172e79147981842aea670ec65931e99d2e7f2",
      "id": "rumi_qr_pairing_connector_pack.connector.qr_pairing",
      "implementation_digest": "sha256:d0df2f80a4ecc591507ba40b2864cfdcb1133d85ed76c1cc612ed89823b970d0",
      "isolation": "dedicated_process",
      "operations": [
        "rumi_qr_pairing_connector_pack.qr-pairing-adapter"
      ],
      "role": "brokered"
    }
  ],
  "integrity": {
    "artifact_set_digest": "sha256:9acd3eb07a00691fc362a847a8276ad98fdf9fad6f625e659f1559cc08b221d4",
    "contract_catalog_digest": "sha256:cc49a2abd6ee74101ebb1189da5d3ba7b81b93a68319527d8cacc72851fee091",
    "source_identity": "sha256:7d7ba73b32dd0334154da53a3dbfb0f6ae7b5b3f18c469058d8d6c1ce4553820"
  },
  "migration": {
    "compatibility": "read_only",
    "legacy_ids": [
      "rumi.service.connector.adapter.v1",
      "rumi:ecosystem/rumi_qr_pairing_connector_pack",
      "rumi_qr_pairing_connector_pack"
    ],
    "removal_wave": 10,
    "sunset_at": "2027-12-31"
  },
  "operation_catalog": [
    {
      "contract_reference": "tobkiri.service.connector.adapter.v1",
      "effect_ceiling": [
        "capability:connector.adapter.verify",
        "capability:connector.delivery.execute"
      ],
      "operation_id": "rumi_qr_pairing_connector_pack.qr-pairing-adapter",
      "owner": "rumi_qr_pairing_connector_pack",
      "provider_id": "rumi_qr_pairing_connector_pack.connector.qr_pairing",
      "source_kind": "v3_contract"
    }
  ],
  "pack": {
    "artifact_digest": "sha256:9acd3eb07a00691fc362a847a8276ad98fdf9fad6f625e659f1559cc08b221d4",
    "display_name": "Rumi QR Pairing Connector",
    "id": "rumi_qr_pairing_connector_pack",
    "kind": "normal_sandbox",
    "version": "1.0.0"
  },
  "pack_api_version": "io.tobkiri.pack.v4",
  "provenance": {
    "evidence": [
      {
        "digest": "sha256:7d7ba73b32dd0334154da53a3dbfb0f6ae7b5b3f18c469058d8d6c1ce4553820",
        "path": "schemas/pack_v4_catalog.v1.json",
        "rule_id": "canonical-pack-v4-source-record"
      }
    ],
    "generator": "tobkiri.scripts.migrate_pack_artifacts_v4",
    "generator_version": "1.0.0",
    "normative": true,
    "repository_commit": "1329f300cd2a8e15170edb1accce8d7c3167882b",
    "repository_tree": "8820370fd87572920444d7c9dc642735b35194e6e1610ad99d242a5958fb876c",
    "schema": "io.tobkiri.provenance.v1",
    "source_digest": "sha256:7d7ba73b32dd0334154da53a3dbfb0f6ae7b5b3f18c469058d8d6c1ce4553820",
    "source_kind": "migration",
    "source_path": "schemas/pack_v4_catalog.v1.json#/packs/rumi_qr_pairing_connector_pack"
  },
  "provider_catalog": [
    {
      "contract_reference": "tobkiri.service.connector.adapter.v1",
      "operations": [
        "rumi_qr_pairing_connector_pack.qr-pairing-adapter"
      ],
      "owner": "rumi_qr_pairing_connector_pack",
      "provider_id": "rumi_qr_pairing_connector_pack.connector.qr_pairing"
    }
  ],
  "requirements": {
    "approval_policy": "capability_gated",
    "capabilities": [
      "connector.adapter.verify",
      "connector.delivery.execute",
      "credential.resolve",
      "host.authority.consume",
      "qr.present"
    ],
    "contract_dependencies": [
      {
        "cardinality": "one",
        "contract_id": "tobkiri.service.credential.resolve.v1",
        "optional": false,
        "version_range": ">=1.0.0 <2.0.0"
      },
      {
        "cardinality": "one",
        "contract_id": "tobkiri.service.host.authorize.v1",
        "optional": false,
        "version_range": ">=1.0.0 <2.0.0"
      },
      {
        "cardinality": "optional",
        "contract_id": "tobkiri.ui.qr.present.v1",
        "optional": true,
        "version_range": ">=1.0.0 <2.0.0"
      }
    ],
    "execution_boundary": "sandbox",
    "network": {
      "allowed_domains": [],
      "allowed_ports": []
    },
    "pack_dependencies": {
      "rumi_credential_broker_pack": ">=1.0.0,<2.0.0",
      "rumi_host_authority_bridge_pack": ">=1.0.0,<2.0.0"
    },
    "secrets": [],
    "workspace_boundary": "pack_local"
  }
}
