{
  "artifacts": [
    {
      "digest": "sha256:0eefb8b32c083309abf0d20688d7769b8533f726f516891de0fead09bfa792ed",
      "kind": "executable",
      "path": "runtime/turns.py"
    }
  ],
  "contracts": [
    {
      "contract_id": "tobkiri.action.turn.lifecycle.v1",
      "operations": [
        "rumi_turn_runtime_pack.turn-lifecycle"
      ],
      "revision_digest": "sha256:a7cf23d352ca9838379fd3acc501c52fb5cb7e4b0b708d4d0c5c637a3bb680f5"
    },
    {
      "contract_id": "tobkiri.event.turn.v1",
      "operations": [
        "rumi_turn_runtime_pack.turn-events"
      ],
      "revision_digest": "sha256:c65360507f2da991fbea5d83a09e510e9d148287f975b8c8d765c2f1dc1485e6"
    },
    {
      "contract_id": "tobkiri.resource.turn.v1",
      "operations": [
        "rumi_turn_runtime_pack.turn-resource"
      ],
      "revision_digest": "sha256:31cacd04091ad82c6e46a1ae66aab82f132202b75c805c5130e38a64ba0c7dd7"
    }
  ],
  "functions": [
    {
      "contract_revision_digest": "sha256:c65360507f2da991fbea5d83a09e510e9d148287f975b8c8d765c2f1dc1485e6",
      "id": "rumi_turn_runtime_pack.turn-runtime.events",
      "implementation_digest": "sha256:0eefb8b32c083309abf0d20688d7769b8533f726f516891de0fead09bfa792ed",
      "isolation": "dedicated_process",
      "operations": [
        "rumi_turn_runtime_pack.turn-events"
      ],
      "role": "host_capability_provider"
    },
    {
      "contract_revision_digest": "sha256:a7cf23d352ca9838379fd3acc501c52fb5cb7e4b0b708d4d0c5c637a3bb680f5",
      "id": "rumi_turn_runtime_pack.turn-runtime.lifecycle",
      "implementation_digest": "sha256:0eefb8b32c083309abf0d20688d7769b8533f726f516891de0fead09bfa792ed",
      "isolation": "dedicated_process",
      "operations": [
        "rumi_turn_runtime_pack.turn-lifecycle"
      ],
      "role": "host_capability_provider"
    },
    {
      "contract_revision_digest": "sha256:31cacd04091ad82c6e46a1ae66aab82f132202b75c805c5130e38a64ba0c7dd7",
      "id": "rumi_turn_runtime_pack.turn-runtime.resource",
      "implementation_digest": "sha256:0eefb8b32c083309abf0d20688d7769b8533f726f516891de0fead09bfa792ed",
      "isolation": "dedicated_process",
      "operations": [
        "rumi_turn_runtime_pack.turn-resource"
      ],
      "role": "host_capability_provider"
    }
  ],
  "integrity": {
    "artifact_set_digest": "sha256:1e9c62b183322d75641a7ee15d0fee7b6b072c950275193fbe26885549d5d32a",
    "contract_catalog_digest": "sha256:f941cb9041ca15d5291cd555afce4b9772b52e7277c2aaecb33bf7eac6579450",
    "source_identity": "sha256:7a213492a668a5b15b268142cda302719c987e4200872b5d5a7dee67ce2cf7f6"
  },
  "migration": {
    "compatibility": "read_only",
    "legacy_ids": [
      "rumi.action.turn.lifecycle.v1",
      "rumi.event.turn.v1",
      "rumi.resource.turn.v1",
      "rumi:ecosystem/rumi_turn_runtime_pack",
      "rumi_turn_runtime_pack"
    ],
    "removal_wave": 10,
    "sunset_at": "2027-12-31"
  },
  "operation_catalog": [
    {
      "contract_reference": "tobkiri.event.turn.v1",
      "effect_ceiling": [
        "capability:turn.read",
        "host:brokered-execution"
      ],
      "operation_id": "rumi_turn_runtime_pack.turn-events",
      "owner": "rumi_turn_runtime_pack",
      "provider_id": "rumi_turn_runtime_pack.turn-runtime.events",
      "source_kind": "v3_contract"
    },
    {
      "contract_reference": "tobkiri.action.turn.lifecycle.v1",
      "effect_ceiling": [
        "capability:turn.manage",
        "host:brokered-execution"
      ],
      "operation_id": "rumi_turn_runtime_pack.turn-lifecycle",
      "owner": "rumi_turn_runtime_pack",
      "provider_id": "rumi_turn_runtime_pack.turn-runtime.lifecycle",
      "source_kind": "v3_contract"
    },
    {
      "contract_reference": "tobkiri.resource.turn.v1",
      "effect_ceiling": [
        "capability:turn.read",
        "host:brokered-execution"
      ],
      "operation_id": "rumi_turn_runtime_pack.turn-resource",
      "owner": "rumi_turn_runtime_pack",
      "provider_id": "rumi_turn_runtime_pack.turn-runtime.resource",
      "source_kind": "v3_contract"
    }
  ],
  "pack": {
    "artifact_digest": "sha256:1e9c62b183322d75641a7ee15d0fee7b6b072c950275193fbe26885549d5d32a",
    "display_name": "Rumi Turn Runtime",
    "id": "rumi_turn_runtime_pack",
    "kind": "host_extension",
    "version": "1.0.0"
  },
  "pack_api_version": "io.tobkiri.pack.v4",
  "provenance": {
    "evidence": [
      {
        "digest": "sha256:7a213492a668a5b15b268142cda302719c987e4200872b5d5a7dee67ce2cf7f6",
        "path": "schemas/pack_v4_catalog.v1.json",
        "rule_id": "canonical-pack-v4-source-record"
      }
    ],
    "generator": "tobkiri.scripts.migrate_pack_artifacts_v4",
    "generator_version": "1.0.0",
    "normative": true,
    "repository_commit": "1329f300cd2a8e15170edb1accce8d7c3167882b",
    "repository_tree": "8820370fd87572920444d7c9dc642735b35194e6e1610ad99d242a5958fb876c",
    "schema": "io.tobkiri.provenance.v1",
    "source_digest": "sha256:7a213492a668a5b15b268142cda302719c987e4200872b5d5a7dee67ce2cf7f6",
    "source_kind": "migration",
    "source_path": "schemas/pack_v4_catalog.v1.json#/packs/rumi_turn_runtime_pack"
  },
  "provider_catalog": [
    {
      "contract_reference": "tobkiri.event.turn.v1",
      "operations": [
        "rumi_turn_runtime_pack.turn-events"
      ],
      "owner": "rumi_turn_runtime_pack",
      "provider_id": "rumi_turn_runtime_pack.turn-runtime.events"
    },
    {
      "contract_reference": "tobkiri.action.turn.lifecycle.v1",
      "operations": [
        "rumi_turn_runtime_pack.turn-lifecycle"
      ],
      "owner": "rumi_turn_runtime_pack",
      "provider_id": "rumi_turn_runtime_pack.turn-runtime.lifecycle"
    },
    {
      "contract_reference": "tobkiri.resource.turn.v1",
      "operations": [
        "rumi_turn_runtime_pack.turn-resource"
      ],
      "owner": "rumi_turn_runtime_pack",
      "provider_id": "rumi_turn_runtime_pack.turn-runtime.resource"
    }
  ],
  "requirements": {
    "approval_policy": "none",
    "capabilities": [
      "turn.manage",
      "turn.read"
    ],
    "contract_dependencies": [
      {
        "cardinality": "one",
        "contract_id": "tobkiri.resource.conversation.v1",
        "optional": false,
        "version_range": ">=1.0.0 <2.0.0"
      },
      {
        "cardinality": "one",
        "contract_id": "tobkiri.resource.message.v1",
        "optional": false,
        "version_range": ">=1.0.0 <2.0.0"
      }
    ],
    "execution_boundary": "host_brokered",
    "network": {
      "allowed_domains": [],
      "allowed_ports": []
    },
    "pack_dependencies": {
      "rumi_conversation_store_pack": ">=1.0.0,<2.0.0"
    },
    "secrets": [],
    "workspace_boundary": "host_brokered"
  }
}
