{
  "artifacts": [
    {
      "digest": "sha256:6dbe7cfb5cdf33b087a42ac19c94bd3c6d64faa6f8913c6c7b1c2aa521d8bc4b",
      "kind": "sidecar",
      "path": "executables.v4.json"
    }
  ],
  "contracts": [],
  "functions": [],
  "integrity": {
    "source_identity": "sha256:8537c0fe1fbdfaf2b04628b0d928a6cf1e2be1470acbbb7df5df36be8b735d09",
    "artifact_set_digest": "sha256:2659dff411d99f840fddc645e9885feb5ac13f610f520591ad3e600a6cd5d3ba",
    "contract_catalog_digest": "sha256:4f53cda18c2baa0c0354bb5f9a3ecbe5ed12ab4d8e11ba873c2f11161202b945"
  },
  "migration": {
    "compatibility": "read_only",
    "legacy_ids": [
      "rumi:ecosystem/rumi_runtime_benchmark_pack",
      "rumi_runtime_benchmark_pack"
    ],
    "removal_wave": 10,
    "sunset_at": "2099-01-01"
  },
  "operation_catalog": [],
  "pack": {
    "artifact_digest": "sha256:ee691a3427da4f76f3b0104f9bf260eefa6bebdd42d7e9c9dea98e2bda52120d",
    "display_name": "Rumi Runtime Benchmark Pack",
    "id": "rumi_runtime_benchmark_pack",
    "kind": "application",
    "version": "0.1.0"
  },
  "pack_api_version": "io.tobkiri.pack.v4",
  "provenance": {
    "schema": "io.tobkiri.provenance.v2",
    "source_kind": "generated",
    "source_path": "ecosystem/rumi_runtime_benchmark_pack/pack.v4.json",
    "source_digest": "sha256:8537c0fe1fbdfaf2b04628b0d928a6cf1e2be1470acbbb7df5df36be8b735d09",
    "repository_commit": "1329f300cd2a8e15170edb1accce8d7c3167882b",
    "repository_commit_trusted": false,
    "content_root_digest": "sha256:124f1e945fec304d113d7b0a539e192489cd05ecfc1658e488ba30659c0ac591",
    "generator": "tobkiri.scripts.generate_defaultspack_v4_bundle",
    "generator_version": "2.1.0",
    "generator_path": "tobkiri_runtime/scripts/generate_defaultspack_v4_bundle.py",
    "generator_digest": "sha256:b12bf4b488bc71de3b95715bc86cbf1791181392e922d1e8e6be926f08288943",
    "input_inventory_digest": "sha256:10a5092cd164263613a6378f126c8d9a1fbd64e8daab51904dcd661d6709ed11",
    "normative": true,
    "evidence": [
      {
        "path": "tobkiri_runtime/scripts/generate_defaultspack_v4_bundle.py",
        "rule_id": "normative-generator-bytes",
        "digest": "sha256:b12bf4b488bc71de3b95715bc86cbf1791181392e922d1e8e6be926f08288943"
      },
      {
        "path": "ecosystem/rumi_runtime_benchmark_pack/pack.v4.json",
        "rule_id": "normative-input-bytes",
        "digest": "sha256:8537c0fe1fbdfaf2b04628b0d928a6cf1e2be1470acbbb7df5df36be8b735d09"
      }
    ]
  },
  "provider_catalog": [],
  "requirements": {
    "approval_policy": "none",
    "capabilities": [],
    "contract_dependencies": [],
    "execution_boundary": "declarative_only",
    "network": {
      "allowed_domains": [],
      "allowed_ports": []
    },
    "pack_dependencies": {},
    "secrets": [],
    "workspace_boundary": "pack_local"
  }
}
