{
  "artifacts": [],
  "contracts": [],
  "functions": [],
  "integrity": {
    "artifact_set_digest": "sha256:4f53cda18c2baa0c0354bb5f9a3ecbe5ed12ab4d8e11ba873c2f11161202b945",
    "contract_catalog_digest": "sha256:8477c76c225b10de6af4f3721a5acbe0857f5a76456815f5cabf8e1e2a10068d",
    "source_identity": "sha256:dcc36012d012a7d50f8ed26ce076574fcb6685f899d9b5a1e0810c30d0437547"
  },
  "migration": {
    "compatibility": "read_only",
    "legacy_ids": [
      "rumi:ecosystem/rumi_security_review_pack",
      "rumi_security_review_pack"
    ],
    "removal_wave": 10,
    "sunset_at": "2099-01-01"
  },
  "operation_catalog": [],
  "pack": {
    "artifact_digest": "sha256:4f53cda18c2baa0c0354bb5f9a3ecbe5ed12ab4d8e11ba873c2f11161202b945",
    "display_name": "rumi_security_review_pack",
    "id": "rumi_security_review_pack",
    "kind": "application",
    "version": "1.0.0"
  },
  "pack_api_version": "io.tobkiri.pack.v4",
  "provenance": {
    "evidence": [
      {
        "digest": "sha256:dcc36012d012a7d50f8ed26ce076574fcb6685f899d9b5a1e0810c30d0437547",
        "path": "schemas/pack_v4_catalog.v1.json",
        "rule_id": "canonical-pack-v4-source-record"
      }
    ],
    "generator": "tobkiri.scripts.migrate_pack_artifacts_v4",
    "generator_version": "1.0.0",
    "normative": true,
    "repository_commit": "1329f300cd2a8e15170edb1accce8d7c3167882b",
    "repository_tree": "8820370fd87572920444d7c9dc642735b35194e6e1610ad99d242a5958fb876c",
    "schema": "io.tobkiri.provenance.v1",
    "source_digest": "sha256:dcc36012d012a7d50f8ed26ce076574fcb6685f899d9b5a1e0810c30d0437547",
    "source_kind": "migration",
    "source_path": "schemas/pack_v4_catalog.v1.json#/packs/rumi_security_review_pack"
  },
  "provider_catalog": [],
  "requirements": {
    "approval_policy": "none",
    "capabilities": [],
    "contract_dependencies": [],
    "execution_boundary": "declarative_only",
    "network": {
      "allowed_domains": [],
      "allowed_ports": []
    },
    "pack_dependencies": {},
    "secrets": [],
    "workspace_boundary": "pack_local"
  }
}
