{
  "artifacts": [
    {
      "digest": "sha256:9f79fddc4bb747277a0623bb2ba6cab74944d20e4fdf35005f4d355c06d6f932",
      "kind": "executable",
      "path": "runtime/read.py"
    }
  ],
  "contracts": [
    {
      "contract_id": "tobkiri.service.git.read.v1",
      "operations": [
        "rumi_git_read_pack.git-read"
      ],
      "revision_digest": "sha256:620f8682cdb4a27c2ac2c94c22536575387b86aeff2cff3465411ae8789c37e5"
    }
  ],
  "functions": [
    {
      "contract_revision_digest": "sha256:620f8682cdb4a27c2ac2c94c22536575387b86aeff2cff3465411ae8789c37e5",
      "id": "rumi_git_read_pack.git-read.service",
      "implementation_digest": "sha256:9f79fddc4bb747277a0623bb2ba6cab74944d20e4fdf35005f4d355c06d6f932",
      "isolation": "dedicated_process",
      "operations": [
        "rumi_git_read_pack.git-read"
      ],
      "role": "host_capability_provider"
    }
  ],
  "integrity": {
    "artifact_set_digest": "sha256:38a66e2749c75439fe6f225f6092daa99765d273014dfffca4c8c66d9277f1f5",
    "contract_catalog_digest": "sha256:fe95dce233ba0e2a9547f8b3f704e34e2ffbd95a1274e93a91afa3644bdbd2fe",
    "source_identity": "sha256:a454b0cfab6a41cdab28721f881e0fd381dbe277087e54d0a52a584fc71c583a"
  },
  "migration": {
    "compatibility": "read_only",
    "legacy_ids": [
      "rumi.service.git.read.v1",
      "rumi:ecosystem/rumi_git_read_pack",
      "rumi_git_read_pack"
    ],
    "removal_wave": 10,
    "sunset_at": "2027-12-31"
  },
  "operation_catalog": [
    {
      "contract_reference": "tobkiri.service.git.read.v1",
      "effect_ceiling": [
        "capability:git.read",
        "host:brokered-execution"
      ],
      "operation_id": "rumi_git_read_pack.git-read",
      "owner": "rumi_git_read_pack",
      "provider_id": "rumi_git_read_pack.git-read.service",
      "source_kind": "v3_contract"
    }
  ],
  "pack": {
    "artifact_digest": "sha256:38a66e2749c75439fe6f225f6092daa99765d273014dfffca4c8c66d9277f1f5",
    "display_name": "Rumi Git Read",
    "id": "rumi_git_read_pack",
    "kind": "host_extension",
    "version": "1.0.0"
  },
  "pack_api_version": "io.tobkiri.pack.v4",
  "provenance": {
    "evidence": [
      {
        "digest": "sha256:a454b0cfab6a41cdab28721f881e0fd381dbe277087e54d0a52a584fc71c583a",
        "path": "schemas/pack_v4_catalog.v1.json",
        "rule_id": "canonical-pack-v4-source-record"
      }
    ],
    "generator": "tobkiri.scripts.migrate_pack_artifacts_v4",
    "generator_version": "1.0.0",
    "normative": true,
    "repository_commit": "1329f300cd2a8e15170edb1accce8d7c3167882b",
    "repository_tree": "8820370fd87572920444d7c9dc642735b35194e6e1610ad99d242a5958fb876c",
    "schema": "io.tobkiri.provenance.v1",
    "source_digest": "sha256:a454b0cfab6a41cdab28721f881e0fd381dbe277087e54d0a52a584fc71c583a",
    "source_kind": "migration",
    "source_path": "schemas/pack_v4_catalog.v1.json#/packs/rumi_git_read_pack"
  },
  "provider_catalog": [
    {
      "contract_reference": "tobkiri.service.git.read.v1",
      "operations": [
        "rumi_git_read_pack.git-read"
      ],
      "owner": "rumi_git_read_pack",
      "provider_id": "rumi_git_read_pack.git-read.service"
    }
  ],
  "requirements": {
    "approval_policy": "none",
    "capabilities": [
      "git.read",
      "workspace.metadata.read"
    ],
    "contract_dependencies": [
      {
        "cardinality": "one",
        "contract_id": "tobkiri.resource.workspace.v1",
        "optional": false,
        "version_range": ">=1.0.0 <2.0.0"
      }
    ],
    "execution_boundary": "host_brokered",
    "network": {
      "allowed_domains": [],
      "allowed_ports": []
    },
    "pack_dependencies": {
      "rumi_workspace_mount_pack": ">=1.0.0,<2.0.0"
    },
    "secrets": [],
    "workspace_boundary": "host_brokered"
  }
}
