{
  "artifacts": [
    {
      "digest": "sha256:cfe9a4696919e228cfd7f8301897261e691c0be3f5fdf117ea9ba2137cb6613a",
      "kind": "sidecar",
      "path": "executables.v4.json"
    }
  ],
  "contracts": [],
  "functions": [],
  "integrity": {
    "source_identity": "sha256:727ae0cfb4d8b643a6dd3d33cea432b52f758d863565f4598e3c5b07201bf8d6",
    "artifact_set_digest": "sha256:0702956c05bb87b8ffaa2d9538754402cdb68b2f266ccaeecbcf15d4c0550d77",
    "contract_catalog_digest": "sha256:4f53cda18c2baa0c0354bb5f9a3ecbe5ed12ab4d8e11ba873c2f11161202b945"
  },
  "migration": {
    "compatibility": "read_only",
    "legacy_ids": [
      "rumi:ecosystem/rumi_document_intelligence_pack",
      "rumi_document_intelligence_pack"
    ],
    "removal_wave": 10,
    "sunset_at": "2099-01-01"
  },
  "operation_catalog": [],
  "pack": {
    "artifact_digest": "sha256:3bdecdcc2d4fdb6b972872a5f1246925d8aac33c8a5929f87ebb00106195d14f",
    "display_name": "Rumi Document Intelligence Pack",
    "id": "rumi_document_intelligence_pack",
    "kind": "application",
    "version": "0.1.0"
  },
  "pack_api_version": "io.tobkiri.pack.v4",
  "provenance": {
    "schema": "io.tobkiri.provenance.v2",
    "source_kind": "generated",
    "source_path": "ecosystem/rumi_document_intelligence_pack/pack.v4.json",
    "source_digest": "sha256:727ae0cfb4d8b643a6dd3d33cea432b52f758d863565f4598e3c5b07201bf8d6",
    "repository_commit": "1329f300cd2a8e15170edb1accce8d7c3167882b",
    "repository_commit_trusted": false,
    "content_root_digest": "sha256:b5f6d3f9e6ebe43bbdaef6b3e32fcd1c87456a1ff0041a44d34dd53ecf2b0264",
    "generator": "tobkiri.scripts.generate_defaultspack_v4_bundle",
    "generator_version": "2.1.0",
    "generator_path": "tobkiri_runtime/scripts/generate_defaultspack_v4_bundle.py",
    "generator_digest": "sha256:b12bf4b488bc71de3b95715bc86cbf1791181392e922d1e8e6be926f08288943",
    "input_inventory_digest": "sha256:b3c970917c0b41e28f9bd724fa1e2c75b9b731972d7cb5308bf658b0d17f4438",
    "normative": true,
    "evidence": [
      {
        "path": "tobkiri_runtime/scripts/generate_defaultspack_v4_bundle.py",
        "rule_id": "normative-generator-bytes",
        "digest": "sha256:b12bf4b488bc71de3b95715bc86cbf1791181392e922d1e8e6be926f08288943"
      },
      {
        "path": "ecosystem/rumi_document_intelligence_pack/pack.v4.json",
        "rule_id": "normative-input-bytes",
        "digest": "sha256:727ae0cfb4d8b643a6dd3d33cea432b52f758d863565f4598e3c5b07201bf8d6"
      }
    ]
  },
  "provider_catalog": [],
  "requirements": {
    "approval_policy": "none",
    "capabilities": [],
    "contract_dependencies": [],
    "execution_boundary": "declarative_only",
    "network": {
      "allowed_domains": [],
      "allowed_ports": []
    },
    "pack_dependencies": {},
    "secrets": [],
    "workspace_boundary": "pack_local"
  }
}
