{
  "artifacts": [],
  "contracts": [],
  "functions": [],
  "integrity": {
    "artifact_set_digest": "sha256:4f53cda18c2baa0c0354bb5f9a3ecbe5ed12ab4d8e11ba873c2f11161202b945",
    "contract_catalog_digest": "sha256:5f1123204ab8c25568444f760c8dc6457a1c0119e0cd0a1dd85a0edc41525d89",
    "source_identity": "sha256:fb61896947908cc882a6bb8de2ea793bfbaf45269982c082d1157cf241cb9f3c"
  },
  "migration": {
    "compatibility": "read_only",
    "legacy_ids": [
      "rumi:ecosystem/rumi_knowledge_marketplace_pack",
      "rumi_knowledge_marketplace_pack"
    ],
    "removal_wave": 10,
    "sunset_at": "2099-01-01"
  },
  "operation_catalog": [
    {
      "effect_ceiling": [],
      "operation_id": "rumi_knowledge_marketplace_pack.marketplace.card_schema",
      "owner": "rumi_knowledge_marketplace_pack",
      "source_kind": "legacy_connectivity"
    },
    {
      "effect_ceiling": [],
      "operation_id": "rumi_knowledge_marketplace_pack.marketplace.install_review_workflow",
      "owner": "rumi_knowledge_marketplace_pack",
      "source_kind": "legacy_connectivity"
    },
    {
      "effect_ceiling": [],
      "operation_id": "rumi_knowledge_marketplace_pack.marketplace.listing_preview",
      "owner": "rumi_knowledge_marketplace_pack",
      "source_kind": "legacy_connectivity"
    },
    {
      "effect_ceiling": [],
      "operation_id": "rumi_knowledge_marketplace_pack.marketplace.model_tiers",
      "owner": "rumi_knowledge_marketplace_pack",
      "source_kind": "legacy_connectivity"
    },
    {
      "effect_ceiling": [],
      "operation_id": "rumi_knowledge_marketplace_pack.marketplace.provenance_ledger",
      "owner": "rumi_knowledge_marketplace_pack",
      "source_kind": "legacy_connectivity"
    },
    {
      "effect_ceiling": [],
      "operation_id": "rumi_knowledge_marketplace_pack.marketplace.tag_requirements",
      "owner": "rumi_knowledge_marketplace_pack",
      "source_kind": "legacy_connectivity"
    },
    {
      "effect_ceiling": [],
      "operation_id": "rumi_knowledge_marketplace_pack.marketplace.trust_rubric",
      "owner": "rumi_knowledge_marketplace_pack",
      "source_kind": "legacy_connectivity"
    }
  ],
  "pack": {
    "artifact_digest": "sha256:4f53cda18c2baa0c0354bb5f9a3ecbe5ed12ab4d8e11ba873c2f11161202b945",
    "display_name": "Rumi Knowledge Marketplace Pack",
    "id": "rumi_knowledge_marketplace_pack",
    "kind": "application",
    "version": "0.2.0"
  },
  "pack_api_version": "io.tobkiri.pack.v4",
  "provenance": {
    "evidence": [
      {
        "digest": "sha256:fb61896947908cc882a6bb8de2ea793bfbaf45269982c082d1157cf241cb9f3c",
        "path": "schemas/pack_v4_catalog.v1.json",
        "rule_id": "canonical-pack-v4-source-record"
      }
    ],
    "generator": "tobkiri.scripts.migrate_pack_artifacts_v4",
    "generator_version": "1.0.0",
    "normative": true,
    "repository_commit": "1329f300cd2a8e15170edb1accce8d7c3167882b",
    "repository_tree": "8820370fd87572920444d7c9dc642735b35194e6e1610ad99d242a5958fb876c",
    "schema": "io.tobkiri.provenance.v1",
    "source_digest": "sha256:fb61896947908cc882a6bb8de2ea793bfbaf45269982c082d1157cf241cb9f3c",
    "source_kind": "migration",
    "source_path": "schemas/pack_v4_catalog.v1.json#/packs/rumi_knowledge_marketplace_pack"
  },
  "provider_catalog": [],
  "requirements": {
    "approval_policy": "none",
    "capabilities": [],
    "contract_dependencies": [],
    "execution_boundary": "declarative_only",
    "network": {
      "allowed_domains": [],
      "allowed_ports": []
    },
    "pack_dependencies": {
      "defaultspack": ">=2.0.0"
    },
    "secrets": [],
    "workspace_boundary": "pack_local"
  }
}
