{
  "artifacts": [
    {
      "digest": "sha256:9eee73b33be955ecc34b1a177ad0bf6465f446e6608338c5e2ae328a86b470e4",
      "kind": "sidecar",
      "path": "executables.v4.json"
    }
  ],
  "contracts": [],
  "functions": [],
  "integrity": {
    "source_identity": "sha256:cae0b20c3bab7870b495e90e0c875d63971119a3d6be932bd414ce464ef3f114",
    "artifact_set_digest": "sha256:5c3d2359fa2d34599bbd5ccb642024829b5b8d9fc67e1931d260d95ea676e8c9",
    "contract_catalog_digest": "sha256:4f53cda18c2baa0c0354bb5f9a3ecbe5ed12ab4d8e11ba873c2f11161202b945"
  },
  "migration": {
    "compatibility": "read_only",
    "legacy_ids": [
      "rumi:ecosystem/rumi_connector_gateway_pack",
      "rumi_connector_gateway_pack"
    ],
    "removal_wave": 10,
    "sunset_at": "2099-01-01"
  },
  "operation_catalog": [],
  "pack": {
    "artifact_digest": "sha256:7c08f69a6702c02d91ad608d5caaa4aaffd43e7a20389ecf0b490f480fb7ced0",
    "display_name": "Rumi Connector Gateway Pack",
    "id": "rumi_connector_gateway_pack",
    "kind": "application",
    "version": "0.1.0"
  },
  "pack_api_version": "io.tobkiri.pack.v4",
  "provenance": {
    "schema": "io.tobkiri.provenance.v2",
    "source_kind": "generated",
    "source_path": "ecosystem/rumi_connector_gateway_pack/pack.v4.json",
    "source_digest": "sha256:cae0b20c3bab7870b495e90e0c875d63971119a3d6be932bd414ce464ef3f114",
    "repository_commit": "1329f300cd2a8e15170edb1accce8d7c3167882b",
    "repository_commit_trusted": false,
    "content_root_digest": "sha256:8787124b04088b6b8539fe77605be24551b33abd17e9ee442ac17d320476854e",
    "generator": "tobkiri.scripts.generate_defaultspack_v4_bundle",
    "generator_version": "2.1.0",
    "generator_path": "tobkiri_runtime/scripts/generate_defaultspack_v4_bundle.py",
    "generator_digest": "sha256:b12bf4b488bc71de3b95715bc86cbf1791181392e922d1e8e6be926f08288943",
    "input_inventory_digest": "sha256:dbf762d3f9415308d9b9c1f04dd9310b4af4d2f64cabf49ba6a821abea730850",
    "normative": true,
    "evidence": [
      {
        "path": "tobkiri_runtime/scripts/generate_defaultspack_v4_bundle.py",
        "rule_id": "normative-generator-bytes",
        "digest": "sha256:b12bf4b488bc71de3b95715bc86cbf1791181392e922d1e8e6be926f08288943"
      },
      {
        "path": "ecosystem/rumi_connector_gateway_pack/pack.v4.json",
        "rule_id": "normative-input-bytes",
        "digest": "sha256:cae0b20c3bab7870b495e90e0c875d63971119a3d6be932bd414ce464ef3f114"
      }
    ]
  },
  "provider_catalog": [],
  "requirements": {
    "approval_policy": "none",
    "capabilities": [],
    "contract_dependencies": [],
    "execution_boundary": "declarative_only",
    "network": {
      "allowed_domains": [],
      "allowed_ports": []
    },
    "pack_dependencies": {},
    "secrets": [],
    "workspace_boundary": "pack_local"
  }
}
